<?xml version="1.0" encoding="UTF-8" standalone="no"?>
<liga xmlns:xsi="http://www.w3.org/2001/XMLSchema-instance" xsi:noNamespaceSchemaLocation="BDD(Clasificacion).xsd">
    <clasificacion>
        <equipo codEquipo="_44">
            <nombre></nombre>
            <puntos></puntos>
            <puesto></puesto>
        </equipo>
        <equipo codEquipo="_43">
            <nombre></nombre>
            <puntos></puntos>
            <puesto></puesto>
        </equipo>
    </clasificacion>
</liga>